{
  "project_id": "tipper-the-story",
  "playbook_id": "flywheel-shorts",
  "description": "Tipper the story — speech long-form → flywheel shorts queue",
  "overrides": {
    "modules": {
      "transcribe": { "enabled": true },
      "render": { "enabled": true, "render_chapters": true }
    },
    "deliverables": {
      "shorts": { "versions": ["hook-first", "story-first", "contiguous"] },
      "chunks": { "count": 3 }
    }
  }
}
